{
  "$schema": "http://json-schema.org/draft-07/schema#",
  "$id": "https://shoonaya.app/schemas/fixture/snapshot/v1",
  "title": "SnapshotFixture",
  "description": "Schema for a snapshot fixture in __fixtures__/snapshot/. Captures current engine behaviour with no source claim. Asserts NO UNINTENDED CHANGE. MUST NOT have a source block.",
  "type": "object",
  "required": [
    "caseId",
    "festivalId",
    "year",
    "location",
    "profile",
    "capturedAt",
    "engineVersion",
    "ruleEngineVersion",
    "captured",
    "approved"
  ],
  "additionalProperties": false,
  "properties": {
    "$schema": { "type": "string" },
    "caseId": {
      "type": "string",
      "description": "Unique identifier. Must NOT appear in the golden/ directory.",
      "pattern": "^[a-z0-9_\\-]+$"
    },
    "festivalId": { "type": "string" },
    "year": { "type": "integer", "minimum": 2000, "maximum": 2100 },
    "location": {
      "type": "object",
      "required": ["label", "lat", "lon", "tz"],
      "additionalProperties": false,
      "properties": {
        "label": { "type": "string" },
        "lat": { "type": "number", "minimum": -90, "maximum": 90 },
        "lon": { "type": "number", "minimum": -180, "maximum": 180 },
        "tz": { "type": "string" }
      }
    },
    "profile": {
      "type": "object",
      "required": ["calendar", "tradition"],
      "additionalProperties": false,
      "properties": {
        "calendar": { "type": "string" },
        "tradition": { "type": "string" },
        "variantKey": { "type": "string" }
      }
    },
    "capturedAt": {
      "type": "string",
      "description": "ISO-8601 UTC instant when the snapshot was generated",
      "pattern": "^[0-9]{4}-[0-9]{2}-[0-9]{2}T"
    },
    "engineVersion": {
      "type": "string",
      "description": "Version of the panchang-engine package at capture time"
    },
    "ruleEngineVersion": {
      "type": "string",
      "description": "RULE_ENGINE_VERSION from engine.ts at capture time"
    },
    "captured": {
      "description": "The engine output at capture time. This is what the regression test compares against.",
      "type": "object",
      "required": ["civilDate"],
      "additionalProperties": false,
      "properties": {
        "civilDate": {
          "type": ["string", "null"],
          "pattern": "^([0-9]{4}-[0-9]{2}-[0-9]{2}|null)$"
        },
        "slug": { "type": "string" },
        "recurring": { "type": ["boolean", "null"] }
      }
    },
    "approved": {
      "type": "boolean",
      "description": "Always false for snapshots — they capture behaviour, not correctness."
    },
    "_comment": {
      "type": "string",
      "description": "Optional human-readable note. DO NOT use this field to claim correctness."
    }
  }
}
