{
  "$schema": "https://shoonaya.app/schemas/fixture/snapshot/v1",
  "caseId": "snap__hanuman-jayanti__2026__bedford_uk__global_sanatan",
  "festivalId": "hanuman-jayanti",
  "year": 2026,
  "location": {
    "label": "Bedford, UK",
    "lat": 52.1356,
    "lon": -0.4685,
    "tz": "Europe/London"
  },
  "profile": {
    "calendar": "global_sanatan",
    "tradition": "unspecified"
  },
  "capturedAt": "2026-08-17T12:41:30.748Z",
  "engineVersion": "0.2.1",
  "ruleEngineVersion": "2.0.0",
  "captured": {
    "civilDate": null,
    "slug": "hanuman-jayanti",
    "recurring": null
  },
  "approved": false,
  "_comment": "Snapshot of current engine behaviour. NOT a correctness assertion. | Captured: 2026-08-17T12:41:30.748Z | D5 note: engine currently computes all locations at Ujjain. | Dates will diverge across locations after D5 (per-location evaluation) is fixed. | Delete this file and regenerate after D5 is shipped."
}
