{
  "$schema": "https://shoonaya.app/schemas/fixture/snapshot/v1",
  "caseId": "snap__diwali__2026__new_york_usa__global_sanatan",
  "festivalId": "diwali",
  "year": 2026,
  "location": {
    "label": "New York, USA",
    "lat": 40.7128,
    "lon": -74.006,
    "tz": "America/New_York"
  },
  "profile": {
    "calendar": "global_sanatan",
    "tradition": "unspecified"
  },
  "capturedAt": "2026-07-30T11:53:40.536Z",
  "engineVersion": "0.1.0",
  "ruleEngineVersion": "1.2.2",
  "captured": {
    "civilDate": "2026-11-08",
    "slug": "diwali",
    "recurring": null
  },
  "approved": false,
  "_comment": "Snapshot of current engine behaviour. NOT a correctness assertion. | Captured: 2026-07-30T11:53:40.536Z | D5 note: engine currently computes all locations at Ujjain. | Dates will diverge across locations after D5 (per-location evaluation) is fixed. | Delete this file and regenerate after D5 is shipped."
}
