{
  "$schema": "https://shoonaya.app/schemas/fixture/snapshot/v1",
  "caseId": "snap__holi__2027__new_york_usa__north_indian_purnimanta",
  "festivalId": "holi",
  "year": 2027,
  "location": {
    "label": "New York, USA",
    "lat": 40.7128,
    "lon": -74.006,
    "tz": "America/New_York"
  },
  "profile": {
    "calendar": "north_indian_purnimanta",
    "tradition": "smarta"
  },
  "capturedAt": "2026-08-17T15:20:44.208Z",
  "engineVersion": "0.2.1",
  "ruleEngineVersion": "2.0.0",
  "captured": {
    "civilDate": "2027-03-22",
    "slug": "holi",
    "recurring": null
  },
  "approved": false,
  "_comment": "Snapshot of current engine behaviour. NOT a correctness assertion. | Captured: 2026-08-17T15:20:44.208Z | D5 note: engine currently computes all locations at Ujjain. | Dates will diverge across locations after D5 (per-location evaluation) is fixed. | Delete this file and regenerate after D5 is shipped."
}
