{
  "$schema": "https://shoonaya.app/schemas/fixture/snapshot/v1",
  "caseId": "snap__hartalika-teej__2028__sydney_australia__global_sanatan",
  "festivalId": "hartalika-teej",
  "year": 2028,
  "location": {
    "label": "Sydney, Australia",
    "lat": -33.8688,
    "lon": 151.2093,
    "tz": "Australia/Sydney"
  },
  "profile": {
    "calendar": "global_sanatan",
    "tradition": "unspecified"
  },
  "capturedAt": "2026-08-17T15:20:44.208Z",
  "engineVersion": "0.2.1",
  "ruleEngineVersion": "2.0.0",
  "captured": {
    "civilDate": null,
    "slug": "hartalika-teej",
    "recurring": null
  },
  "approved": false,
  "_comment": "Snapshot of current engine behaviour. NOT a correctness assertion. | Captured: 2026-08-17T15:20:44.208Z | D5 note: engine currently computes all locations at Ujjain. | Dates will diverge across locations after D5 (per-location evaluation) is fixed. | Delete this file and regenerate after D5 is shipped."
}
