{
  "$schema": "https://shoonaya.app/schemas/fixture/snapshot/v1",
  "caseId": "snap__dussehra__2028__bedford_uk__north_indian_purnimanta",
  "festivalId": "dussehra",
  "year": 2028,
  "location": {
    "label": "Bedford, UK",
    "lat": 52.1356,
    "lon": -0.4685,
    "tz": "Europe/London"
  },
  "profile": {
    "calendar": "north_indian_purnimanta",
    "tradition": "smarta"
  },
  "capturedAt": "2026-08-17T15:20:44.208Z",
  "engineVersion": "0.2.1",
  "ruleEngineVersion": "2.0.0",
  "captured": {
    "civilDate": "2028-09-28",
    "slug": "dussehra",
    "recurring": null
  },
  "approved": false,
  "_comment": "Snapshot of current engine behaviour. NOT a correctness assertion. | Captured: 2026-08-17T15:20:44.208Z | D5 note: engine currently computes all locations at Ujjain. | Dates will diverge across locations after D5 (per-location evaluation) is fixed. | Delete this file and regenerate after D5 is shipped."
}
