{
  "$schema": "https://shoonaya.app/schemas/fixture/snapshot/v1",
  "caseId": "snap__ram-navami__2027__chennai_india__gujarati_amanta",
  "festivalId": "ram-navami",
  "year": 2027,
  "location": {
    "label": "Chennai, India",
    "lat": 13.0827,
    "lon": 80.2707,
    "tz": "Asia/Kolkata"
  },
  "profile": {
    "calendar": "gujarati_amanta",
    "tradition": "smarta"
  },
  "capturedAt": "2026-07-30T11:53:40.536Z",
  "engineVersion": "0.1.0",
  "ruleEngineVersion": "1.2.2",
  "captured": {
    "civilDate": "2027-03-17",
    "slug": "ram-navami",
    "recurring": null
  },
  "approved": false,
  "_comment": "Snapshot of current engine behaviour. NOT a correctness assertion. | Captured: 2026-07-30T11:53:40.536Z | D5 note: engine currently computes all locations at Ujjain. | Dates will diverge across locations after D5 (per-location evaluation) is fixed. | Delete this file and regenerate after D5 is shipped."
}
