{
  "$schema": "https://shoonaya.app/schemas/fixture/snapshot/v1",
  "caseId": "snap__ganesh-chaturthi__2027__new_york_usa__gujarati_amanta",
  "festivalId": "ganesh-chaturthi",
  "year": 2027,
  "location": {
    "label": "New York, USA",
    "lat": 40.7128,
    "lon": -74.006,
    "tz": "America/New_York"
  },
  "profile": {
    "calendar": "gujarati_amanta",
    "tradition": "smarta"
  },
  "capturedAt": "2026-07-30T11:53:40.536Z",
  "engineVersion": "0.1.0",
  "ruleEngineVersion": "1.2.2",
  "captured": {
    "civilDate": "2027-09-04",
    "slug": "ganesh-chaturthi",
    "recurring": null
  },
  "approved": false,
  "_comment": "Snapshot of current engine behaviour. NOT a correctness assertion. | Captured: 2026-07-30T11:53:40.536Z | D5 note: engine currently computes all locations at Ujjain. | Dates will diverge across locations after D5 (per-location evaluation) is fixed. | Delete this file and regenerate after D5 is shipped."
}
