{
  "$schema": "https://shoonaya.app/schemas/fixture/snapshot/v1",
  "caseId": "snap__chaitra-navratri-begins__2028__chennai_india__global_sanatan",
  "festivalId": "chaitra-navratri-begins",
  "year": 2028,
  "location": {
    "label": "Chennai, India",
    "lat": 13.0827,
    "lon": 80.2707,
    "tz": "Asia/Kolkata"
  },
  "profile": {
    "calendar": "global_sanatan",
    "tradition": "unspecified"
  },
  "capturedAt": "2026-09-27T13:58:46Z",
  "engineVersion": "0.2.1",
  "ruleEngineVersion": "2.0.0",
  "captured": {
    "civilDate": "2028-03-27",
    "slug": "chaitra-navratri-begins",
    "recurring": null
  },
  "approved": false,
  "_comment": "Snapshot of current engine behaviour. NOT a correctness assertion. | Captured: 2026-09-27T13:58:46Z | D5 note: engine currently computes all locations at Ujjain. | Dates will diverge across locations after D5 (per-location evaluation) is fixed. | Delete this file and regenerate after D5 is shipped."
}
