{
  "$schema": "https://shoonaya.app/schemas/fixture/snapshot/v1",
  "caseId": "snap__makar-sankranti__2028__bedford_uk__gujarati_amanta",
  "festivalId": "makar-sankranti",
  "year": 2028,
  "location": {
    "label": "Bedford, UK",
    "lat": 52.1356,
    "lon": -0.4685,
    "tz": "Europe/London"
  },
  "profile": {
    "calendar": "gujarati_amanta",
    "tradition": "smarta"
  },
  "capturedAt": "2026-07-30T11:53:40.536Z",
  "engineVersion": "0.1.0",
  "ruleEngineVersion": "1.2.2",
  "captured": {
    "civilDate": "2028-01-14",
    "slug": "makar-sankranti",
    "recurring": null
  },
  "approved": false,
  "_comment": "Snapshot of current engine behaviour. NOT a correctness assertion. | Captured: 2026-07-30T11:53:40.536Z | D5 note: engine currently computes all locations at Ujjain. | Dates will diverge across locations after D5 (per-location evaluation) is fixed. | Delete this file and regenerate after D5 is shipped."
}
