{
  "$schema": "https://shoonaya.app/schemas/fixture/snapshot/v1",
  "caseId": "snap__onam__2027__chennai_india__north_indian_purnimanta",
  "festivalId": "onam",
  "year": 2027,
  "location": {
    "label": "Chennai, India",
    "lat": 13.0827,
    "lon": 80.2707,
    "tz": "Asia/Kolkata"
  },
  "profile": {
    "calendar": "north_indian_purnimanta",
    "tradition": "smarta"
  },
  "capturedAt": "2026-08-17T15:20:44.208Z",
  "engineVersion": "0.2.1",
  "ruleEngineVersion": "2.0.0",
  "captured": {
    "civilDate": null,
    "slug": "onam",
    "recurring": null
  },
  "approved": false,
  "_comment": "Snapshot of current engine behaviour. NOT a correctness assertion. | Captured: 2026-08-17T15:20:44.208Z | D5 note: engine currently computes all locations at Ujjain. | Dates will diverge across locations after D5 (per-location evaluation) is fixed. | Delete this file and regenerate after D5 is shipped."
}
