{
  "$schema": "https://shoonaya.app/schemas/fixture/snapshot/v1",
  "caseId": "snap__krishna-janmashtami__2028__ujjain_india__gujarati_amanta",
  "festivalId": "krishna-janmashtami",
  "year": 2028,
  "location": {
    "label": "Ujjain, India",
    "lat": 23.1765,
    "lon": 75.7885,
    "tz": "Asia/Kolkata"
  },
  "profile": {
    "calendar": "gujarati_amanta",
    "tradition": "smarta"
  },
  "capturedAt": "2026-08-17T12:41:30.748Z",
  "engineVersion": "0.2.1",
  "ruleEngineVersion": "2.0.0",
  "captured": {
    "civilDate": "2028-08-13",
    "slug": "krishna-janmashtami",
    "recurring": null
  },
  "approved": false,
  "_comment": "Snapshot of current engine behaviour. NOT a correctness assertion. | Captured: 2026-08-17T12:41:30.748Z | D5 note: engine currently computes all locations at Ujjain. | Dates will diverge across locations after D5 (per-location evaluation) is fixed. | Delete this file and regenerate after D5 is shipped."
}
