{
  "$schema": "https://shoonaya.app/schemas/fixture/snapshot/v1",
  "caseId": "snap__akshaya-tritiya__2026__ujjain_india__gujarati_amanta",
  "festivalId": "akshaya-tritiya",
  "year": 2026,
  "location": {
    "label": "Ujjain, India",
    "lat": 23.1765,
    "lon": 75.7885,
    "tz": "Asia/Kolkata"
  },
  "profile": {
    "calendar": "gujarati_amanta",
    "tradition": "smarta"
  },
  "capturedAt": "2026-09-08T19:52:11.339Z",
  "engineVersion": "0.2.4",
  "ruleEngineVersion": "2.0.0",
  "captured": {
    "civilDate": null,
    "slug": "akshaya-tritiya",
    "recurring": null
  },
  "approved": false,
  "_comment": "Snapshot of current engine behaviour. NOT a correctness assertion. | Captured: 2026-09-08T19:52:11.339Z | D5 note: engine currently computes all locations at Ujjain. | Dates will diverge across locations after D5 (per-location evaluation) is fixed. | Delete this file and regenerate after D5 is shipped."
}
