{
  "$schema": "https://shoonaya.app/schemas/fixture/snapshot/v1",
  "caseId": "snap__chhath-puja__2027__new_york_usa__global_sanatan",
  "festivalId": "chhath-puja",
  "year": 2027,
  "location": {
    "label": "New York, USA",
    "lat": 40.7128,
    "lon": -74.006,
    "tz": "America/New_York"
  },
  "profile": {
    "calendar": "global_sanatan",
    "tradition": "unspecified"
  },
  "capturedAt": "2026-09-27T13:58:46Z",
  "engineVersion": "0.2.1",
  "ruleEngineVersion": "2.0.0",
  "captured": {
    "civilDate": "2027-11-04",
    "slug": "chhath-puja",
    "recurring": null
  },
  "approved": false,
  "_comment": "Snapshot of current engine behaviour. NOT a correctness assertion. | Captured: 2026-09-27T13:58:46Z | D5 note: engine currently computes all locations at Ujjain. | Dates will diverge across locations after D5 (per-location evaluation) is fixed. | Delete this file and regenerate after D5 is shipped."
}
